Jounral Name,1999,2000,2001,2002,2003,2004,2005,2006,2007,2008,2009,2010,2011,2012,2013,2014,2015
ACM Transactions on Internet Technology,62.50,0.0,9.09,58.82,0.0,57.14,38.10,33.33,50.00,0.0,31.25,35.71,0.0,46.67,0.0,26.32,42.86
ACM Transactions on Sensor Networks,76.92,0.0,0.0,53.33,0.0,42.03,0.0,22.64,27.78,0.0,24.44,31.82,0.0,36.11,0.0,0.0,45.16
ACM Transactions on the Web,72.73,0.0,0.0,57.14,0.0,42.11,0.0,52.94,42.86,0.0,45.45,0.0,0.0,50.00,0.0,0.0,50.00
Acta Informatica,23.81,33.33,20.00,46.88,34.62,37.04,12.00,42.11,52.63,13.33,38.46,24.24,24.14,45.83,48.15,38.46,29.41
Ad Hoc Networks,13.89,0.0,11.11,34.63,0.0,27.59,22.73,15.87,34.58,0.0,12.96,18.82,0.0,25.44,0.0,28.57,31.63
Advances in Mathematics of Communications,0.0,0.0,0.0,35.71,0.0,26.47,0.0,41.67,40.00,0.0,40.63,0.0,0.0,43.75,0.0,0.0,46.88
Biomedical Instrumentation and Technology,8.84,2.38,2.78,0.00,1.41,1.50,2.44,2.23,0.61,0.00,3.85,7.69,2.75,0.64,1.52,5.03,1.75
BIT Numerical Mathematics,37.50,18.18,23.64,28.95,27.66,41.77,25.00,29.55,24.53,32.65,45.00,17.31,24.64,36.54,22.97,37.50,26.53
China Communications,0.0,0.0,0.0,17.58,0.0,8.61,0.0,3.65,8.23,0.0,7.94,0.0,0.0,9.41,0.0,0.0,16.84
Cluster Computing,11.54,0.0,0.0,26.50,0.0,33.62,0.0,25.00,36.36,0.0,26.67,24.32,0.0,44.83,0.0,17.65,28.00
Computer Communications,24.51,5.88,19.30,32.07,13.33,28.00,16.92,25.96,25.00,16.25,20.56,22.90,21.00,31.22,16.13,21.49,31.39
Computer Graphics Forum,24.68,10.98,20.29,35.85,4.11,40.07,22.22,29.48,28.57,14.86,31.36,23.17,16.00,30.14,7.50,23.33,33.88
Computer Networks,22.27,22.09,20.55,39.17,13.58,39.55,21.33,32.90,33.81,20.28,30.73,23.26,23.91,29.17,10.56,27.83,32.21
Computing and Informatics,23.33,16.13,19.35,28.21,35.29,24.24,30.56,20.37,18.18,46.88,24.49,13.89,27.59,23.19,50.00,17.24,23.33
Concurrency Computation Practice and Experience,21.09,13.04,20.45,24.93,9.09,25.71,18.29,26.28,28.03,13.75,28.13,17.45,25.40,25.75,21.31,17.24,33.73
Cryptography and Communications,0.0,0.0,0.0,20.00,0.0,36.67,0.0,28.57,15.00,0.0,0.0,0.0,0.0,6.25,0.0,0.0,53.33
Data Mining and Knowledge Discovery,17.65,20.00,40.00,51.02,16.67,40.85,30.43,33.33,24.24,18.75,23.53,26.67,22.22,25.53,14.29,43.33,31.25
Distributed Computing,46.43,31.25,27.27,59.38,33.33,58.33,21.74,33.33,51.85,31.58,47.06,41.67,20.00,57.14,15.00,40.00,61.90
Electronic Commerce Research and Applications,27.78,0.0,20.69,33.33,0.0,21.05,25.81,32.76,33.33,0.0,38.89,23.53,20.00,29.63,0.0,13.33,38.10
Eurasip Journal on Wireless Communications and Networking,27.61,0.0,0.0,31.13,0.0,25.60,25.64,33.44,35.71,0.0,32.64,26.52,0.0,31.25,0.0,38.04,24.74
First Monday,18.75,12.12,5.26,14.43,14.29,17.20,10.99,11.94,13.51,10.13,8.11,12.50,5.63,17.11,7.81,17.34,7.53
Foundations and Trends in Communications and Information Theory,50.00,0.0,0.0,0.00,0.0,0.00,0.00,0.00,33.33,0.0,50.00,50.00,0.0,50.00,0.0,40.00,66.67
Foundations and Trends in Networking,0.00,0.0,0.0,0.00,0.0,0.00,0.0,33.33,33.33,0.0,20.00,50.00,0.0,50.00,0.0,0.0,0.00
Future Generation Computer Systems,25.61,20.45,16.38,28.74,16.67,34.59,29.32,29.05,29.27,24.32,29.81,20.75,21.43,30.41,22.34,31.13,29.79
IEEE Communications Magazine,42.22,5.33,29.19,48.20,13.64,44.30,33.17,30.23,38.97,23.62,34.63,41.47,13.94,42.35,19.70,37.20,36.68
IEEE Intelligent Systems,32.22,17.28,22.78,37.70,20.63,31.43,31.11,33.73,32.39,13.10,31.17,23.16,17.58,18.57,12.94,31.44,36.25
IEEE Internet Computing,25.53,7.94,12.66,23.17,1.89,22.50,16.87,19.19,18.27,8.24,36.49,17.20,9.47,23.16,7.32,15.79,19.78
IEEE Journal on Selected Areas in Communications,70.06,31.29,25.60,53.88,20.00,47.42,29.19,44.68,41.11,31.68,40.40,41.48,28.76,43.66,29.52,34.14,52.27
IEEE Network,35.85,2.50,21.74,52.94,11.11,51.39,34.15,40.82,62.50,13.16,38.10,41.67,18.37,45.45,24.39,25.00,49.25
IEEE Security and Privacy,8.00,0.0,12.73,17.28,0.0,12.00,20.59,7.41,4.63,0.0,7.21,7.84,0.0,6.19,0.0,16.67,6.36
IEEE Transactions on Human-Machine Systems,40.63,12.00,21.57,26.61,0.00,17.14,25.81,32.31,34.15,30.19,24.56,23.97,29.41,33.97,19.64,29.41,25.00
IEEE Transactions on Information Forensics and Security,62.86,0.0,0.0,40.39,0.0,41.30,0.0,31.76,33.61,0.0,32.14,45.71,0.0,30.00,0.0,0.0,40.23
IEEE Transactions on Mobile Computing,83.64,0.0,3.23,44.38,0.0,41.40,13.64,31.54,34.09,0.0,31.67,55.56,31.25,39.47,0.0,34.75,34.72
IEEE Transactions on Network and Service Management,40.00,0.0,0.0,56.25,0.0,58.97,0.0,31.25,38.71,0.0,50.00,0.0,0.0,42.11,0.0,0.0,33.33
IEEE Transactions on Neural Networks and Learning Systems,30.48,45.00,24.09,26.63,44.44,23.14,30.32,32.57,34.27,31.33,36.59,28.57,19.73,33.33,24.18,29.11,38.59
IEEE Transactions on Services Computing,0.0,0.0,0.0,50.82,0.0,41.07,0.0,58.62,26.67,0.0,37.93,0.0,0.0,44.44,0.0,0.0,47.83
IEEE Transactions on Vehicular Technology,34.38,8.76,25.97,42.00,9.44,45.39,24.62,34.51,40.09,27.54,29.55,31.72,16.25,37.44,32.24,32.26,36.90
IEICE Transactions on Communications,6.68,5.41,9.50,15.13,5.54,13.87,29.70,9.80,11.73,7.85,8.21,8.73,6.76,9.39,11.28,22.93,13.04
IET Information Security,37.50,0.0,0.0,21.74,0.0,23.68,0.0,25.00,19.23,0.0,35.71,0.0,0.0,20.51,0.0,0.0,32.56
Information Security Technical Report,15.15,0.00,11.43,0,3.85,0,25.00,8.00,33.33,7.41,9.09,9.68,12.50,16.67,0.00,3.45,29.41
Information Systems Frontiers,33.33,0.0,15.38,40.17,9.68,40.45,34.62,38.46,30.19,11.11,28.00,30.00,15.15,32.00,23.53,36.36,28.81
Information Systems Journal,21.88,12.50,15.00,38.00,12.50,23.08,22.73,37.04,33.33,19.05,31.03,25.00,19.05,25.00,23.08,16.67,25.00
Information Systems Research,17.24,27.27,31.82,56.25,8.33,41.18,15.38,35.09,47.06,6.90,50.00,14.81,22.73,32.89,0.00,25.93,42.86
International Journal for Multiscale Computational Engineering,24.32,0.0,0.0,19.35,0.0,12.50,0.0,20.59,18.75,0.0,22.22,28.95,0.0,27.91,0.0,0.0,23.08
International Journal of Ad Hoc and Ubiquitous Computing,19.05,0.0,0.0,35.85,0.0,28.99,0.0,8.11,14.29,0.0,32.43,29.41,0.0,27.87,0.0,0.0,19.72
International Journal of Applied Cryptography,0.0,0.0,0.0,0,0.0,0.00,0.0,30.77,0,0.0,33.33,0.0,0.0,33.33,0.0,0.0,0.00
International Journal of Business Data Communications and Networking,0.0,0.0,0.0,0.00,0.0,0.00,0.0,31.82,10.00,0.0,23.53,0.0,0.0,16.67,0.0,0.0,23.81
International Journal of Communication Networks and Distributed Systems,0.0,0.0,0.0,21.05,0.0,16.67,0.0,24.00,25.00,0.0,17.31,0.0,0.0,32.35,0.0,0.0,12.96
International Journal of Communication Networks and Information Security,0.0,0.0,0.0,9.09,0.0,20.83,0.0,8.82,26.92,0.0,0.0,0.0,0.0,30.00,0.0,0.0,19.05
International Journal of Communication Systems,15.49,28.57,17.86,12.75,38.46,20.38,27.27,23.33,24.76,24.53,20.24,16.67,15.79,24.07,14.75,29.69,20.00
International Journal of Computer Applications in Technology,67.35,18.52,24.66,20.27,10.53,21.92,16.44,10.19,20.19,0.00,20.72,63.72,17.91,13.11,0.00,10.84,10.17
International Journal of Distance Education Technologies,19.05,0.0,0.0,0.00,0.0,16.67,0.0,36.36,20.83,0.0,0.00,26.92,0.0,9.09,0.0,21.43,31.03
International Journal of Distributed Sensor Networks,27.27,0.0,0.0,23.05,0.0,25.49,0.0,22.22,15.00,0.0,5.56,9.52,0.0,21.14,0.0,0.0,23.10
International Journal of Electronic Government Research,0.0,0.0,0.0,25.00,0.0,25.00,0.0,25.00,16.67,0.0,8.33,0.0,0.0,33.33,0.0,0.0,13.64
International Journal of Electronic Security and Digital Forensics,13.33,0.0,0.0,8.00,0.0,4.17,0.0,8.00,0,0.0,15.15,0.0,0.0,9.52,0.0,0.0,11.76
International Journal of Grid and High Performance Computing,0.0,0.0,0.0,21.74,0.0,38.89,0.0,9.09,14.29,0.0,0.0,0.0,0.0,12.50,0.0,0.0,16.67
International Journal of High Performance Computing and Networking,28.00,0.0,0.0,17.65,0.0,28.57,24.32,10.00,28.57,0.0,37.50,9.09,0.0,14.29,0.0,14.29,25.00
International Journal of Information Management,13.33,12.50,10.00,24.10,23.33,35.44,16.28,22.73,22.22,12.50,10.53,10.26,13.95,25.68,9.38,22.22,25.58
International Journal of Information Security,33.33,0.0,0.0,42.50,0.0,28.57,0.0,26.92,51.72,0.0,22.58,32.14,0.0,41.38,0.0,18.18,55.56
International Journal of Information Technology and Management,50.00,0.0,20.83,15.79,0.0,0.00,19.23,34.62,50.00,0.0,36.00,40.91,3.85,18.18,0.0,17.39,22.22
International Journal of Internet Manufacturing and Services,22.73,0.0,0.0,40.00,0.0,20.00,0.0,10.53,33.33,0.0,50.00,0.0,0.0,0,0.0,0.0,0.00
International Journal of Internet Protocol Technology,20.00,0.0,0.0,0.00,0.0,25.00,0.0,42.11,13.04,0.0,11.76,25.93,0.0,33.33,0.0,6.67,30.00
International Journal of Internet Technology and Secured Transactions,0,0.0,0.0,40.00,0.0,14.29,0.0,25.00,17.86,0.0,50.00,0.0,0.0,15.79,0.0,0.0,0.00
International Journal of Mobile Communications,73.91,0.0,26.67,33.33,0.0,24.24,25.00,38.24,21.21,0.0,26.32,26.19,0.0,28.57,0.0,33.33,28.57
International Journal of Mobile Computing and Multimedia Communications,0.0,0.0,0.0,0,0.0,5.26,0.0,21.05,15.00,0.0,0.0,0.0,0.0,40.91,0.0,0.0,30.43
International Journal of Mobile Network Design and Innovation,0,0.0,0.0,7.69,0.0,23.08,0.0,0.00,0.00,0.0,16.67,14.29,0.0,9.09,0.0,9.52,8.33
International Journal of Network Management,17.14,0.00,13.51,48.28,0.00,35.71,12.20,16.67,38.71,3.23,9.38,11.11,2.63,26.67,0.00,11.11,26.09
International Journal of Network Security,12.16,0.0,0.0,18.89,0.0,23.44,0.0,9.26,10.53,0.0,5.88,18.75,0.0,9.52,0.0,4.48,11.86
International Journal of Networking and Virtual Organisations,79.17,0.0,22.22,31.25,0.0,26.92,33.33,29.73,16.28,0.0,20.51,45.45,16.67,20.00,0.0,17.39,7.14
International Journal of Neural Systems,34.09,0.00,0.00,41.30,0.00,50.00,18.60,45.24,35.00,0.00,21.05,24.44,15.22,29.73,0.00,16.67,42.50
International Journal of Security and Networks,0,0.0,0.0,0.00,0.0,12.00,0.0,23.08,9.52,0.0,21.74,18.18,0.0,21.74,0.0,0.0,6.25
International Journal of Sensor Networks,25.49,0.0,0.0,30.12,0.0,18.18,0.0,26.83,20.00,0.0,37.78,21.74,0.0,28.57,0.0,0.0,25.00
International Journal of Software Engineering and Knowledge Engineering,26.00,14.29,12.90,23.73,11.11,28.79,14.10,27.66,23.53,18.18,17.02,30.23,18.18,29.17,15.15,20.51,37.50
International Journal of Telemedicine and Applications,0.0,0.0,0.0,25.00,0.0,20.00,0.0,7.14,5.56,0.0,20.00,0.0,0.0,11.54,0.0,0.0,20.00
International Journal of Web Based Communities,18.18,0.0,0.0,20.00,0.0,6.06,7.41,11.54,20.69,0.0,11.76,20.59,0.0,12.50,0.0,22.58,9.38
International Journal of Web Engineering and Technology,90.91,0.0,13.04,27.78,0.0,28.57,42.86,25.00,11.11,0.0,19.05,47.83,0.0,35.29,0.0,12.50,30.00
International Journal of Web Information Systems,28.57,0.0,0.0,16.67,0.0,19.05,0.0,16.67,5.00,0.0,9.52,31.25,0.0,16.67,0.0,20.00,12.50
International Journal of Web Services Research,40.00,0.0,0.0,29.41,0.0,42.11,0.0,28.57,50.00,0.0,9.52,34.78,0.0,50.00,0.0,20.00,66.67
International Journal of Wireless Information Networks,23.53,43.48,20.00,24.24,30.00,16.67,52.00,26.67,32.14,9.52,29.17,12.00,28.57,19.35,60.00,27.59,16.22
Internet and Higher Education,14.81,0.00,0.00,24.24,7.14,15.15,11.54,10.42,9.09,3.85,17.39,9.09,4.00,12.50,18.18,12.50,19.35
Journal of Asynchronous Learning Network,0.0,0,29.63,0.00,23.81,2.38,0,0.00,3.45,20.00,0.00,0,26.09,5.00,29.41,0,11.11
Journal of China Universities of Posts and Telecommunications,1.71,0.0,0.0,4.23,0.0,5.31,0.0,3.03,4.71,0.0,2.56,1.64,0.0,8.43,0.0,0.0,3.98
Journal of Communications and Networks,14.00,0.0,26.67,30.51,9.76,36.11,40.38,20.59,25.00,13.89,23.44,25.86,36.59,11.54,29.27,21.82,17.14
Journal of Computer Information Systems,6.38,7.02,13.73,35.00,3.39,17.50,14.29,26.42,14.29,0.00,25.93,8.16,6.67,25.00,3.45,14.75,31.25
Journal of Computer Science,0.0,0.0,0.0,6.54,0.0,9.17,0.0,9.01,4.40,0.0,6.94,0.0,0.0,3.82,0.0,0.0,8.76
Journal of Computer Security,32.14,12.50,20.69,46.15,0.00,38.46,17.86,35.90,33.33,0.00,41.38,26.09,39.13,21.74,25.00,13.04,37.93
Journal of Computer-Mediated Communication,57.89,26.09,12.90,21.95,23.53,28.07,18.03,3.13,4.76,11.54,15.00,10.96,18.18,9.09,8.70,14.00,25.00
Journal of Electronic Commerce in Organizations,20.00,0.0,0.0,11.76,0.0,4.55,0.0,33.33,23.08,0.0,23.81,0.00,0.0,10.53,0.0,14.29,28.57
Journal of Emerging Technologies in Web Intelligence,0.0,0.0,0.0,0,0.0,9.52,0.0,12.24,25.71,0.0,0.0,0.0,0.0,20.83,0.0,0.0,22.64
Journal of Grid Computing,40.74,0.0,37.93,34.09,0.0,41.03,11.76,32.14,28.13,0.0,48.48,44.00,0.0,15.38,0.0,25.93,33.33
Journal of Heuristics,26.67,9.09,29.63,41.67,23.08,25.64,30.43,24.39,46.43,27.27,37.04,32.00,18.18,30.56,24.14,21.74,37.50
Journal of High Speed Networks,12.50,15.79,26.32,32.00,31.25,4.76,9.09,57.14,25.00,7.69,0,24.00,12.50,0.00,28.57,20.69,17.39
Journal of Information and Knowledge Management,14.29,0.0,7.14,13.89,0.0,18.92,16.00,36.67,19.35,0.0,10.71,7.14,11.11,12.90,0.0,19.35,14.29
Journal of Intelligent Information Systems,32.00,4.76,20.83,29.27,20.00,26.87,8.70,29.41,34.21,26.67,30.77,19.23,37.04,20.34,7.69,23.33,40.82
Journal of Interconnection Networks,0.0,0.0,0.0,25.00,0.0,0,0.0,50.00,35.00,0.0,20.69,0.0,0.0,50.00,0.0,0.0,18.75
Journal of Internet Banking and Commerce,0.0,0.0,0.0,15.87,0.0,15.15,0.0,10.91,5.66,0.0,0.0,0.0,0.0,6.90,0.0,0.0,2.63
Journal of Internet Technology,6.94,0.0,0.0,22.56,0.0,23.97,12.96,26.23,15.05,0.0,18.57,9.26,0.0,15.12,0.0,22.92,17.76
Journal of Location Based Services,0.0,0.0,0.0,6.67,0.0,16.67,0.0,12.50,12.50,0.0,17.65,0.0,0.0,46.67,0.0,0.0,29.41
Journal of Microelectronics and Electronic Packaging,14.29,43.59,0.0,0,0,16.67,0.0,18.52,20.83,0,10.00,17.86,0.0,5.26,0,14.29,0
Journal of Network and Computer Applications,11.54,25.00,15.38,33.53,21.74,30.34,26.67,19.05,25.95,0.00,21.88,18.75,17.65,32.60,42.11,15.00,30.57
Journal of Network and Systems Management,44.83,32.26,15.38,22.58,29.63,35.42,32.26,31.03,26.67,21.88,20.83,16.13,30.77,38.24,35.00,36.11,28.95
Journal of Networks,10.94,0.0,0.0,0,0.0,8.50,0.0,14.95,9.38,0.0,13.91,17.07,0.0,9.26,0.0,0.0,13.05
Journal of Optical Communications and Networking,0.0,0.0,0.0,34.86,0.0,34.95,0.0,24.24,38.60,0.0,0.0,0.0,0.0,30.88,0.0,0.0,32.32
Journal of Parallel and Distributed Computing,26.45,23.94,25.00,35.71,23.88,27.21,26.19,32.71,27.21,27.38,25.84,27.17,26.47,29.25,18.68,28.23,30.00
Journal of Research and Practice in Information Technology,35.00,25.00,10.00,0,12.50,0,13.79,23.81,35.00,20.00,17.39,16.67,12.50,22.22,6.45,34.62,0
Journal of Technology in Human Services,12.00,6.25,0.00,0.00,5.88,4.55,11.11,15.00,10.53,13.33,9.09,3.85,0.00,17.24,0.00,0.00,4.35
Journal of Web Engineering,0.0,0.0,0.0,30.43,0.0,18.52,0.0,23.53,46.15,0.0,29.41,0.0,0.0,16.67,0.0,0.0,22.22
Journal on Chain and Network Science,30.77,0.0,25.00,16.67,0.0,30.00,27.27,27.78,30.00,16.67,25.00,33.33,25.00,23.81,0.0,23.08,25.00
KSII Transactions on Internet and Information Systems,13.64,0.0,0.0,13.40,0.0,16.54,0.0,27.03,16.54,0.0,15.38,0.0,0.0,15.15,0.0,0.0,16.13
Microprocessors and Microsystems,13.64,14.10,3.64,15.83,14.29,21.05,14.63,14.29,29.41,12.24,31.25,11.32,11.76,20.63,17.78,13.64,30.91
Mobile Information Systems,0.0,0.0,0.0,27.27,0.0,31.82,0.0,47.37,45.00,0.0,0.0,0.0,0.0,38.10,0.0,0.0,42.11
Mobile Networks and Applications,26.00,36.00,25.86,50.00,46.43,41.98,25.64,33.33,42.65,11.90,23.81,23.68,15.52,56.00,19.15,42.19,41.77
Multimedia Systems,18.37,20.93,20.59,34.43,25.00,32.29,25.49,32.14,25.71,29.41,26.92,17.14,12.77,29.03,0,29.09,40.91
Multimedia Tools and Applications,13.04,37.04,32.43,25.03,38.89,24.84,30.36,26.67,25.81,11.43,20.88,29.73,31.71,28.64,28.57,26.76,25.25
Networks,39.29,23.33,27.27,44.26,24.07,29.09,34.04,25.00,33.33,22.92,32.31,26.23,42.22,34.48,17.78,31.91,33.96
Networks and Spatial Economics,26.92,0.0,0.0,36.51,0.0,40.74,0.0,17.24,45.95,0.0,22.22,36.36,0.0,24.14,0.0,40.91,38.10
Neural Processing Letters,8.33,13.46,17.86,19.13,9.30,14.04,7.14,13.51,22.50,4.44,12.50,20.00,5.56,8.11,23.08,23.08,24.59
New Generation Computing,31.25,18.18,19.23,23.81,3.57,23.53,14.29,25.00,14.29,0.00,6.67,24.24,16.00,12.50,0.00,11.11,6.25
New Review of Information Networking,20.00,0.00,5.56,0,0.00,33.33,0.00,12.50,20.00,6.25,0,0.00,0.00,25.00,0.00,9.09,28.57
Optical Switching and Networking,28.00,0.0,0.0,29.41,0.0,32.47,0.0,57.14,50.00,0.0,21.21,10.53,0.0,35.48,0.0,16.67,37.50
Parallel Computing,21.82,11.76,24.29,25.76,15.22,22.67,19.05,21.15,22.03,12.64,27.27,20.34,23.08,15.79,17.53,16.67,32.26
Peer-to-Peer Networking and Applications,0.0,0.0,0.0,34.09,0.0,33.33,0.0,35.71,30.00,0.0,0.0,0.0,0.0,43.33,0.0,0.0,27.08
Performance Evaluation,43.64,38.30,19.44,38.00,33.33,35.48,34.94,42.22,35.44,27.27,26.42,28.36,34.43,37.50,18.52,27.42,44.29
Photonic Network Communications,24.53,0.0,19.57,22.68,48.15,31.75,25.00,14.93,12.07,16.67,19.40,6.45,15.56,23.64,43.75,26.79,17.65
Problems of Information Transmission,20.00,0.0,0.0,20.00,0.0,25.00,0.0,11.11,14.29,0.0,15.79,25.00,0.0,24.00,0.0,20.00,16.13
Real-Time Systems,17.24,10.00,35.29,55.17,14.81,50.00,20.00,21.74,20.00,0.00,33.33,33.33,21.74,42.31,16.67,20.00,44.00
Security and Communication Networks,0.0,0.0,0.0,17.22,0.0,33.04,0.0,30.23,26.67,0.0,0.0,0.0,0.0,26.36,0.0,0.0,33.09
Semantic Web and Information Systems,47.06,0.0,0.0,33.33,0.0,28.57,0.0,15.38,30.77,0.0,37.50,22.22,0.0,47.06,0.0,23.53,58.33
Systems Engineering,25.00,14.29,16.67,18.18,5.00,13.89,8.00,12.50,13.33,11.54,5.26,14.29,23.81,8.57,25.00,19.05,16.67
Telematics and Informatics,19.05,0.00,17.39,20.99,11.11,18.92,8.33,18.60,28.57,9.09,15.15,25.00,4.76,7.69,0.00,10.00,17.50
Universal Access in the Information Society,28.57,0.0,18.18,31.75,0.0,17.81,17.65,19.35,16.67,0.0,44.44,5.88,0.0,20.00,0.0,14.81,19.35
Web Semantics,27.27,0.0,40.74,23.81,0.0,35.29,33.33,30.77,50.00,0.0,43.33,16.00,0.0,52.17,0.0,25.00,40.00
Wireless Communications and Mobile Computing,21.43,0.0,19.18,25.82,0.0,44.80,33.33,24.78,40.15,72.22,30.23,18.75,19.72,36.09,0.0,50.00,35.25
Wireless Networks,26.56,50.00,39.66,25.50,48.78,28.77,31.67,21.09,30.83,0.00,20.48,22.22,26.32,28.79,17.65,33.80,27.74
World Wide Web,31.58,0.0,18.75,33.90,0.0,34.18,28.57,34.78,48.28,0.0,38.10,22.73,0.0,46.67,0.0,16.00,56.90
WSEAS Transactions on Communications,13.01,0.0,0.0,0,0.0,10.81,0.0,8.45,2.63,0.0,9.17,4.62,0.0,9.52,0.0,10.64,14.52
WSEAS Transactions on Signal Processing,0.0,0.0,0.0,0,0.0,7.55,0.0,0.00,7.14,0.0,13.16,0.0,0.0,0.00,0.0,0.0,8.70